{
  "request_id": "11111111-2222-4333-8444-555555555555",
  "job_id": "88888888-8888-4888-8888-888888888888",
  "provider_id": "google-flow-pro",
  "provider_job_id": "flow-task-987654321",
  "status": "SUCCESS",
  "generation_status": "SUCCEEDED",
  "progress_percent": 100,
  "output_uri": "https://storage.aivideofactory.com/projects/p1/takes/take_01.mp4",
  "output_metadata": {
    "mime_type": "video/mp4",
    "byte_size": 24576000,
    "checksum_sha256": "e3b0c44298fc1c149afbf4c8996fb92427ae41e4649b934ca495991b7852b855",
    "duration_ms": 5000
  },
  "cost_credits_used": 10.5,
  "timestamp_utc": "2026-08-16T12:02:30Z"
}
