{
  "request_id": "22222222-3333-4444-8555-666666666666",
  "job_id": "88888888-8888-4888-8888-888888888888",
  "provider_id": "google-flow-pro",
  "provider_job_id": "flow-task-987654321",
  "status": "RUNNING",
  "generation_status": "PROCESSING",
  "progress_percent": 65.5,
  "timestamp_utc": "2026-08-16T12:01:00Z"
}
